{
  "retention_days": 90,
  "schema_version": 1,
  "sources": [
    {
      "active_until": "2027-01-20T14:32:34Z",
      "board": "abound",
      "company": "Abound",
      "consecutive_failures": 0,
      "first_discovered_at": "2026-08-25T09:53:12Z",
      "last_checked_at": "2026-10-22T14:32:34Z",
      "last_relevant_listing_at": "2026-10-22T14:32:34Z",
      "type": "ashby"
    },
    {
      "active_until": "2027-01-20T14:32:34Z",
      "board": "acorns",
      "company": "Acorns",
      "consecutive_failures": 0,
      "first_discovered_at": "2026-08-13T04:10:25Z",
      "last_checked_at": "2026-10-22T14:32:34Z",
      "last_relevant_listing_at": "2026-10-22T14:32:34Z",
      "type": "ashby"
    },
    {
      "active_until": "2027-01-20T14:32:34Z",
      "board": "anyscale",
      "company": "Anyscale",
      "consecutive_failures": 0,
      "first_discovered_at": "2026-08-13T10:30:40Z",
      "last_checked_at": "2026-10-22T14:32:34Z",
      "last_relevant_listing_at": "2026-10-22T14:32:34Z",
      "type": "ashby"
    },
    {
      "active_until": "2027-01-20T14:32:34Z",
      "board": "apex-technology-inc",
      "company": "Apex Technology Inc",
      "consecutive_failures": 0,
      "first_discovered_at": "2026-08-13T10:30:40Z",
      "last_checked_at": "2026-10-22T14:32:34Z",
      "last_relevant_listing_at": "2026-10-22T14:32:34Z",
      "type": "ashby"
    },
    {
      "active_until": "2027-01-20T14:32:34Z",
      "board": "ashby-embed-demo-org",
      "company": "Ashby Embed Demo Org",
      "consecutive_failures": 0,
      "first_discovered_at": "2026-08-13T04:10:25Z",
      "last_checked_at": "2026-10-22T14:32:34Z",
      "last_relevant_listing_at": "2026-10-22T14:32:34Z",
      "type": "ashby"
    },
    {
      "active_until": "2027-01-20T14:32:34Z",
      "board": "astera",
      "company": "Astera",
      "consecutive_failures": 0,
      "first_discovered_at": "2026-08-13T10:30:40Z",
      "last_checked_at": "2026-10-22T14:32:34Z",
      "last_relevant_listing_at": "2026-10-22T14:32:34Z",
      "type": "ashby"
    },
    {
      "active_until": "2027-01-20T14:32:34Z",
      "board": "attio",
      "company": "Attio",
      "consecutive_failures": 0,
      "first_discovered_at": "2026-08-29T14:31:02Z",
      "last_checked_at": "2026-10-22T14:32:34Z",
      "last_relevant_listing_at": "2026-10-22T14:32:34Z",
      "type": "ashby"
    },
    {
      "active_until": "2027-01-20T14:32:34Z",
      "board": "baseten",
      "company": "Baseten",
      "consecutive_failures": 0,
      "first_discovered_at": "2026-08-14T10:18:38Z",
      "last_checked_at": "2026-10-22T14:32:34Z",
      "last_relevant_listing_at": "2026-10-22T14:32:34Z",
      "type": "ashby"
    },
    {
      "active_until": "2027-01-20T14:32:34Z",
      "board": "bjakcareer",
      "company": "Bjakcareer",
      "consecutive_failures": 0,
      "first_discovered_at": "2026-08-25T09:53:12Z",
      "last_checked_at": "2026-10-22T14:32:34Z",
      "last_relevant_listing_at": "2026-10-22T14:32:34Z",
      "type": "ashby"
    },
    {
      "active_until": "2027-01-20T14:32:34Z",
      "board": "bland",
      "company": "Bland",
      "consecutive_failures": 0,
      "first_discovered_at": "2026-08-29T14:31:02Z",
      "last_checked_at": "2026-10-22T14:32:34Z",
      "last_relevant_listing_at": "2026-10-22T14:32:34Z",
      "type": "ashby"
    },
    {
      "active_until": "2027-01-20T14:32:34Z",
      "board": "candidhealth",
      "company": "Candidhealth",
      "consecutive_failures": 0,
      "first_discovered_at": "2026-08-13T04:10:25Z",
      "last_checked_at": "2026-10-22T14:32:34Z",
      "last_relevant_listing_at": "2026-10-22T14:32:34Z",
      "type": "ashby"
    },
    {
      "active_until": "2027-01-20T14:32:34Z",
      "board": "capchase",
      "company": "Capchase",
      "consecutive_failures": 0,
      "first_discovered_at": "2026-08-13T10:30:40Z",
      "last_checked_at": "2026-10-22T14:32:34Z",
      "last_relevant_listing_at": "2026-10-22T14:32:34Z",
      "type": "ashby"
    },
    {
      "active_until": "2027-01-20T14:32:34Z",
      "board": "cape",
      "company": "Cape",
      "consecutive_failures": 0,
      "first_discovered_at": "2026-08-13T10:30:40Z",
      "last_checked_at": "2026-10-22T14:32:34Z",
      "last_relevant_listing_at": "2026-10-22T14:32:34Z",
      "type": "ashby"
    },
    {
      "active_until": "2027-01-20T14:32:34Z",
      "board": "causaly",
      "company": "Causaly",
      "consecutive_failures": 0,
      "first_discovered_at": "2026-08-13T04:10:25Z",
      "last_checked_at": "2026-10-22T14:32:34Z",
      "last_relevant_listing_at": "2026-10-22T14:32:34Z",
      "type": "ashby"
    },
    {
      "active_until": "2027-01-20T14:32:34Z",
      "board": "citizen",
      "company": "Citizen",
      "consecutive_failures": 0,
      "first_discovered_at": "2026-09-26T13:46:05Z",
      "last_checked_at": "2026-10-22T14:32:34Z",
      "last_relevant_listing_at": "2026-10-22T14:32:34Z",
      "type": "ashby"
    },
    {
      "active_until": "2027-01-20T14:32:34Z",
      "board": "claylabs",
      "company": "Claylabs",
      "consecutive_failures": 0,
      "first_discovered_at": "2026-08-29T14:31:02Z",
      "last_checked_at": "2026-10-22T14:32:34Z",
      "last_relevant_listing_at": "2026-10-22T14:32:34Z",
      "type": "ashby"
    },
    {
      "active_until": "2027-01-20T14:32:34Z",
      "board": "clera",
      "company": "Clera",
      "consecutive_failures": 0,
      "first_discovered_at": "2026-08-25T09:53:12Z",
      "last_checked_at": "2026-10-22T14:32:34Z",
      "last_relevant_listing_at": "2026-10-22T14:32:34Z",
      "type": "ashby"
    },
    {
      "active_until": "2027-01-04T15:59:31Z",
      "board": "clipboard",
      "company": "Clipboard",
      "consecutive_failures": 0,
      "first_discovered_at": "2026-09-19T13:12:29Z",
      "last_checked_at": "2026-10-22T14:32:34Z",
      "last_relevant_listing_at": "2026-10-06T15:59:31Z",
      "type": "ashby"
    },
    {
      "active_until": "2027-01-20T14:32:34Z",
      "board": "cohere",
      "company": "Cohere",
      "consecutive_failures": 0,
      "first_discovered_at": "2026-08-13T04:10:25Z",
      "last_checked_at": "2026-10-22T14:32:34Z",
      "last_relevant_listing_at": "2026-10-22T14:32:34Z",
      "type": "ashby"
    },
    {
      "active_until": "2027-01-20T14:32:34Z",
      "board": "column",
      "company": "Column",
      "consecutive_failures": 0,
      "first_discovered_at": "2026-08-13T04:10:25Z",
      "last_checked_at": "2026-10-22T14:32:34Z",
      "last_relevant_listing_at": "2026-10-22T14:32:34Z",
      "type": "ashby"
    },
    {
      "active_until": "2027-01-20T14:32:34Z",
      "board": "conduit",
      "company": "Conduit",
      "consecutive_failures": 0,
      "first_discovered_at": "2026-09-16T14:13:46Z",
      "last_checked_at": "2026-10-22T14:32:34Z",
      "last_relevant_listing_at": "2026-10-22T14:32:34Z",
      "type": "ashby"
    },
    {
      "active_until": "2027-01-20T14:32:34Z",
      "board": "corti",
      "company": "Corti",
      "consecutive_failures": 0,
      "first_discovered_at": "2026-08-29T14:31:02Z",
      "last_checked_at": "2026-10-22T14:32:34Z",
      "last_relevant_listing_at": "2026-10-22T14:32:34Z",
      "type": "ashby"
    },
    {
      "active_until": "2026-12-21T14:03:39Z",
      "board": "cradlebio",
      "company": "Cradlebio",
      "consecutive_failures": 0,
      "first_discovered_at": "2026-08-29T14:31:02Z",
      "last_checked_at": "2026-10-22T14:32:34Z",
      "last_relevant_listing_at": "2026-09-22T14:03:39Z",
      "type": "ashby"
    },
    {
      "active_until": "2027-01-20T14:32:34Z",
      "board": "creditgenie",
      "company": "Creditgenie",
      "consecutive_failures": 0,
      "first_discovered_at": "2026-08-13T04:10:25Z",
      "last_checked_at": "2026-10-22T14:32:34Z",
      "last_relevant_listing_at": "2026-10-22T14:32:34Z",
      "type": "ashby"
    },
    {
      "active_until": "2027-01-20T14:32:34Z",
      "board": "crusoe",
      "company": "Crusoe",
      "consecutive_failures": 0,
      "first_discovered_at": "2026-08-13T04:10:25Z",
      "last_checked_at": "2026-10-22T14:32:34Z",
      "last_relevant_listing_at": "2026-10-22T14:32:34Z",
      "type": "ashby"
    },
    {
      "active_until": "2027-01-20T14:32:34Z",
      "board": "d-matrix",
      "company": "D Matrix",
      "consecutive_failures": 0,
      "first_discovered_at": "2026-08-13T04:10:25Z",
      "last_checked_at": "2026-10-22T14:32:34Z",
      "last_relevant_listing_at": "2026-10-22T14:32:34Z",
      "type": "ashby"
    },
    {
      "active_until": "2027-01-20T14:32:34Z",
      "board": "decagon",
      "company": "Decagon",
      "consecutive_failures": 0,
      "first_discovered_at": "2026-08-13T10:30:40Z",
      "last_checked_at": "2026-10-22T14:32:34Z",
      "last_relevant_listing_at": "2026-10-22T14:32:34Z",
      "type": "ashby"
    },
    {
      "active_until": "2027-01-20T14:32:34Z",
      "board": "deepgram",
      "company": "Deepgram",
      "consecutive_failures": 0,
      "first_discovered_at": "2026-08-13T10:30:40Z",
      "last_checked_at": "2026-10-22T14:32:34Z",
      "last_relevant_listing_at": "2026-10-22T14:32:34Z",
      "type": "ashby"
    },
    {
      "active_until": "2027-01-20T14:32:34Z",
      "board": "deepl",
      "company": "Deepl",
      "consecutive_failures": 0,
      "first_discovered_at": "2026-08-29T14:31:02Z",
      "last_checked_at": "2026-10-22T14:32:34Z",
      "last_relevant_listing_at": "2026-10-22T14:32:34Z",
      "type": "ashby"
    },
    {
      "active_until": "2027-01-20T14:32:34Z",
      "board": "docplanner",
      "company": "Docplanner",
      "consecutive_failures": 0,
      "first_discovered_at": "2026-08-13T10:30:40Z",
      "last_checked_at": "2026-10-22T14:32:34Z",
      "last_relevant_listing_at": "2026-10-22T14:32:34Z",
      "type": "ashby"
    },
    {